[
  {
    "address": "0xeeeeeeeeeeeeeeeeeeeeeeeeeeeeeeeeeeeeeeee",
    "mintId": "4zMMC9srt5Ri5X14GAgXhaHii3GnPAEERYPJgZJDncDU",
    "gasPool": "AemAMiD1sczXVFcLHMp4yk3CTXxBRDDDGmBn8RTw98Tb",
    "symbol": "USDC",
    "name": "Rome Esquiline",
    "decimals": 18,
    "kind": "gas",
    "assetRef": "usdc"
  }
]
