[
  {
    "address": "0xeeeeeeeeeeeeeeeeeeeeeeeeeeeeeeeeeeeeeeee",
    "mintId": "6F5YWWrUMNpee8C6BDUc6DmRvYRMDDTgJHwKhbXuifWs",
    "gasPool": "2ypdYWLzohr5HJEso3JqYrX4VqCDvDzTokooymjFQdyd",
    "symbol": "ETH",
    "name": "Rome Aventine",
    "decimals": 18,
    "kind": "gas",
    "assetRef": "eth"
  }
]
