[
  {
    "address": "0xeeeeeeeeeeeeeeeeeeeeeeeeeeeeeeeeeeeeeeee",
    "mintId": "DtC6BVwJ8LgyMcojpv1FgnF7pfWMohAoJakGDiiPEz3q",
    "gasPool": "HHp6mLXQ6GNuiwmBLFKqXVQCWcpdY6dFra4pWP3cMVpr",
    "symbol": "SOL",
    "name": "Rome Cassius",
    "decimals": 18,
    "kind": "gas",
    "assetRef": "sol"
  },
  {
    "address": "0xfa979bb1345cdacbc95bc2d9fb0f6a0e8c7527e2",
    "mintId": "So11111111111111111111111111111111111111112",
    "symbol": "WSOL",
    "name": "Rome Wrapped SOL",
    "decimals": 9,
    "kind": "spl_wrapper",
    "assetRef": "sol",
    "underlying": {
      "chain": "solana-devnet",
      "asset": "SOL"
    },
    "factory": "ERC20SPLFactory"
  }
]
