[
  {
    "address": "0xeeeeeeeeeeeeeeeeeeeeeeeeeeeeeeeeeeeeeeee",
    "symbol": "USDC",
    "name": "Rome Marcus",
    "decimals": 18,
    "kind": "gas",
    "assetRef": "usdc"
  },
  {
    "address": "0x1f7dfaf9444d46fc10b4b4736d906da5caf46195",
    "mintId": "4zMMC9srt5Ri5X14GAgXhaHii3GnPAEERYPJgZJDncDU",
    "symbol": "WUSDC",
    "name": "Rome Wrapped USDC",
    "decimals": 6,
    "kind": "spl_wrapper",
    "assetRef": "usdc",
    "underlying": { "chain": "solana-devnet", "asset": "USDC" },
    "factory": "ERC20SPLFactory",
    "deployedAt": "2026-04-26T00:00:00Z"
  },
  {
    "address": "0x3d81cb32d32b917a1ba3778832536cbf63c3cc15",
    "mintId": "6F5YWWrUMNpee8C6BDUc6DmRvYRMDDTgJHwKhbXuifWs",
    "symbol": "WETH",
    "name": "Rome Wrapped ETH",
    "decimals": 18,
    "kind": "spl_wrapper",
    "assetRef": "eth",
    "underlying": { "chain": "sepolia", "asset": "ETH" },
    "factory": "ERC20SPLFactory",
    "deployedAt": "2026-04-26T00:00:00Z"
  }
]
