[
  {
    "address": "0xeeeeeeeeeeeeeeeeeeeeeeeeeeeeeeeeeeeeeeee",
    "mintId": "4zMMC9srt5Ri5X14GAgXhaHii3GnPAEERYPJgZJDncDU",
    "gasPool": "7iHAeYT7WDRwHiAoHuctN3pENcQLcBfzphUvajM9py9j",
    "symbol": "USDC",
    "name": "Rome Marcus",
    "decimals": 18,
    "kind": "gas",
    "assetRef": "usdc"
  },
  {
    "address": "0xd804b352745e2b0e6a834f6f5212920546347914",
    "mintId": "4zMMC9srt5Ri5X14GAgXhaHii3GnPAEERYPJgZJDncDU",
    "symbol": "WUSDC",
    "name": "Rome Wrapped USDC",
    "decimals": 6,
    "kind": "spl_wrapper",
    "assetRef": "usdc",
    "underlying": {
      "chain": "solana-devnet",
      "asset": "USDC"
    },
    "factory": "ERC20SPLFactory"
  },
  {
    "address": "0x8eb46e73b2fc23952b4aab0b9f491c2ec5e46051",
    "mintId": "6F5YWWrUMNpee8C6BDUc6DmRvYRMDDTgJHwKhbXuifWs",
    "symbol": "WETH",
    "name": "Rome Wrapped ETH",
    "decimals": 8,
    "kind": "spl_wrapper",
    "assetRef": "eth",
    "underlying": {
      "chain": "solana-devnet",
      "asset": "ETH"
    },
    "factory": "ERC20SPLFactory"
  }
]
